{
  "$schema": "release-state-contract.schema.json",
  "contract": "money-map-slice6-release-state-authority-v1",
  "origin": "Every name, date, amount, row, and identifier is invented and reviewed before candidate execution.",
  "fixed_authority": {
    "fixture_contract_version": "money-map-slice6-release-state-authority-v1",
    "reference_instant": "2026-08-10T12:00:00-04:00",
    "eastern_business_date": "2026-08-10",
    "database_revision": "0009_goal_persistence",
    "identifier_allocation": "state-order-then-domain-order-positive-integers-v1",
    "exact_decimal_representation": "base-10-string-with-two-to-four-fractional-digits",
    "ordering_rule": "date-ascending-then-stable-positive-id; UI summaries use date-descending-then-id-descending",
    "rounding_rule": "Decimal ROUND_HALF_EVEN only at an explicitly declared currency boundary",
    "evidence_currentness_rule": "evidence dated within 32 calendar days of the Eastern business date is current; older evidence is stale",
    "safe_copy_comparison_rule": "Unicode NFC and exact whitespace-normalized text; amounts compare as Decimal strings, never localized floats",
    "route_vocabulary": ["cash-flow", "goals", "activity", "accounts", "income", "wealth", "retirement", "lab", "overview", "add-account", "data-home", "diagnostics", "reports"],
    "api_status_vocabulary": ["200", "409", "422", "500", "503", "native-command", "not-requested"]
  },
  "authority_registry": {
    "AUTH-RELEASE-MATRIX": "docs/v3/desktop-release-qualification.md#state-and-route-matrix",
    "AUTH-DESKTOP-LIFECYCLE": "docs/v3/desktop-product-experience.md#window-and-runtime-lifecycle",
    "AUTH-DESKTOP-COPY": "docs/v3/desktop-product-experience.md#state-focus-and-accessibility-language",
    "AUTH-DIAGNOSTICS": "docs/v3/desktop-product-experience.md#reports-printing-and-diagnostics",
    "AUTH-LIFE-FIXTURE": "tests/fixtures/synthetic/v1_2_1/states.json",
    "AUTH-LOADING-TEST": "web/src/App.test.tsx:281",
    "AUTH-RECOVERY-TEST": "web/src/App.test.tsx:205",
    "AUTH-UNAVAILABLE-TEST": "web/src/App.test.tsx:287",
    "AUTH-EMPTY-TEST": "web/src/components.test.tsx:644",
    "AUTH-PARTIAL-CASHFLOW": "tests/test_v21_cash_flow_service.py:test_partial_boundaries_and_zero_activity_months_are_explicit",
    "AUTH-CASHFLOW-UNAVAILABLE": "tests/test_v21_cash_flow_service.py:test_all_history_without_bank_coverage_is_explicitly_unavailable",
    "AUTH-GOAL-COPY": "web/src/goals/GoalsView.test.tsx:136",
    "AUTH-GOAL-PARTIAL": "web/src/goals/GoalsView.test.tsx:170",
    "AUTH-GOAL-SERVICE": "tests/test_goal_service.py",
    "AUTH-RETIREMENT": "web/src/retirement/RetirementView.test.tsx",
    "AUTH-LIFE-LAB": "web/src/life-lab/LifeLabView.test.tsx",
    "AUTH-LARGE-HISTORY": "web/src/components.test.tsx:633",
    "AUTH-INCOME-EMPTY": "web/src/components.test.tsx:867",
    "AUTH-WEALTH-EMPTY": "web/src/components.test.tsx:654",
    "AUTH-DATA-HOME": "web/src/data-home.test.tsx:169",
    "AUTH-REPORT": "docs/v3/desktop-product-experience.md#reports-printing-and-diagnostics",
    "AUTH-API": "src/paycheck_map/api.py",
    "AUTH-DECIMAL": "tests/test_v21_contracts.py",
    "AUTH-NETWORK": "docs/v3/release-contract.md#security-gates"
  },
  "state_defaults": {
    "state_contract_version": "money-map-slice6-release-state-authority-v1",
    "synthetic_reference_instant": "2026-08-10T12:00:00-04:00",
    "expected_database_revision": "0009_goal_persistence",
    "setup_policy": {
      "permitted_writes": ["declared_schema_metadata", "declared_synthetic_seed_rows_before_launch"],
      "forbidden_writes": ["owner_data", "production_keychain", "candidate_generated_expectations", "undeclared_seed_rows", "post_seal_fixture_changes"]
    },
    "expected_network_classification": "authenticated-ephemeral-ipv4-loopback-only",
    "cleanup_requirements": ["quit_app", "stop_sidecar", "remove_listener", "release_writer_lock", "clear_session_material", "remove_disposable_fake_home"]
  },
  "routes": {
    "cash-flow": {
      "id": "cash-flow",
      "authority_refs": ["AUTH-RELEASE-MATRIX", "AUTH-PARTIAL-CASHFLOW", "AUTH-CASHFLOW-UNAVAILABLE"],
      "combination_defaults": {
        "applicable": true,
        "expected_api_endpoints": ["GET /api/v2/cash-flow?period_kind=all_imported_history", "GET /api/v2/cash-flow/recurring-outflow-candidates"],
        "expected_http_status": ["200", "200"],
        "expected_stable_response_fields": {"route": "cash-flow", "period_kind": "all_imported_history"},
        "expected_primary_result": "Cash Flow evidence for the declared imported period.",
        "expected_next_action": "Open the binding goal milestone or supporting money detail.",
        "expected_safe_state_language": ["Cash Flow", "Evidence"],
        "expected_accessible_role": "heading",
        "expected_accessible_status": "settled",
        "expected_enabled_operations": ["reload", "print"],
        "expected_disabled_operations": [],
        "expected_write_count_on_open": 0,
        "expected_after_reload": "same_route_and_same_semantics",
        "expected_network_classification": "authenticated-ephemeral-ipv4-loopback-only",
        "forbidden_material": ["secret", "raw_identifier", "raw_transaction_description", "path", "port", "pid", "session", "exception"],
        "authority_refs": []
      }
    },
    "goals": {
      "id": "goals",
      "authority_refs": ["AUTH-RELEASE-MATRIX", "AUTH-GOAL-COPY", "AUTH-GOAL-SERVICE"],
      "combination_defaults": {
        "applicable": true,
        "expected_api_endpoints": ["GET /api/v2/goals/primary", "GET /api/v2/goals/position", "GET /api/v2/goals/comparison", "GET /api/v2/goals/milestone"],
        "expected_http_status": ["200", "200", "200", "200"],
        "expected_stable_response_fields": {"route": "goals", "one_binding_milestone": true},
        "expected_primary_result": "One primary goal position and one binding milestone.",
        "expected_next_action": "Follow the one binding milestone supported by current evidence.",
        "expected_safe_state_language": ["Goals", "Observed"],
        "expected_accessible_role": "heading",
        "expected_accessible_status": "settled",
        "expected_enabled_operations": ["reload", "print"],
        "expected_disabled_operations": [],
        "expected_write_count_on_open": 0,
        "expected_after_reload": "same_route_and_same_semantics",
        "expected_network_classification": "authenticated-ephemeral-ipv4-loopback-only",
        "forbidden_material": ["secret", "raw_identifier", "raw_transaction_description", "path", "port", "pid", "session", "exception"],
        "authority_refs": []
      }
    },
    "activity": {
      "id": "activity",
      "authority_refs": ["AUTH-RELEASE-MATRIX", "AUTH-API"],
      "combination_defaults": {
        "applicable": true,
        "expected_api_endpoints": ["GET /api/accounts"],
        "expected_http_status": ["200"],
        "expected_stable_response_fields": {"route": "activity", "ordering": "date-descending-then-id-descending"},
        "expected_primary_result": "Imported account activity in deterministic newest-first order.",
        "expected_next_action": "Filter money in, money out, or inspect the supporting account.",
        "expected_safe_state_language": ["Activity"],
        "expected_accessible_role": "heading",
        "expected_accessible_status": "settled",
        "expected_enabled_operations": ["reload"],
        "expected_disabled_operations": [],
        "expected_write_count_on_open": 0,
        "expected_after_reload": "same_route_and_same_semantics",
        "expected_network_classification": "authenticated-ephemeral-ipv4-loopback-only",
        "forbidden_material": ["secret", "raw_identifier", "raw_transaction_description", "path", "port", "pid", "session", "exception"],
        "authority_refs": []
      }
    },
    "accounts": {
      "id": "accounts",
      "authority_refs": ["AUTH-RELEASE-MATRIX", "AUTH-EMPTY-TEST"],
      "combination_defaults": {
        "applicable": true,
        "expected_api_endpoints": ["GET /api/accounts"],
        "expected_http_status": ["200"],
        "expected_stable_response_fields": {"route": "accounts", "totals_are_decimal_strings": true},
        "expected_primary_result": "Account balances with an evidence-backed net-worth classification.",
        "expected_next_action": "Open one account or use Add account when evidence is absent.",
        "expected_safe_state_language": ["Accounts"],
        "expected_accessible_role": "heading",
        "expected_accessible_status": "settled",
        "expected_enabled_operations": ["reload"],
        "expected_disabled_operations": [],
        "expected_write_count_on_open": 0,
        "expected_after_reload": "same_route_and_same_semantics",
        "expected_network_classification": "authenticated-ephemeral-ipv4-loopback-only",
        "forbidden_material": ["secret", "raw_identifier", "raw_transaction_description", "path", "port", "pid", "session", "exception"],
        "authority_refs": []
      }
    },
    "income": {
      "id": "income",
      "authority_refs": ["AUTH-RELEASE-MATRIX", "AUTH-INCOME-EMPTY", "AUTH-API"],
      "combination_defaults": {
        "applicable": true,
        "expected_api_endpoints": ["GET /api/payroll"],
        "expected_http_status": ["200"],
        "expected_stable_response_fields": {"route": "income", "amounts_are_decimal_strings": true},
        "expected_primary_result": "Imported paycheck evidence and exact spendable-pay reconciliation.",
        "expected_next_action": "Open a paycheck or use Add account to import payroll evidence.",
        "expected_safe_state_language": ["Income"],
        "expected_accessible_role": "heading",
        "expected_accessible_status": "settled",
        "expected_enabled_operations": ["reload"],
        "expected_disabled_operations": [],
        "expected_write_count_on_open": 0,
        "expected_after_reload": "same_route_and_same_semantics",